{
  "siteSourceKey": "site_public_fixture",
  "eventId": "00000000-0000-4000-8000-000000000003",
  "eventName": "site_page_view",
  "occurredAt": "2026-08-02T09:00:00.000Z",
  "anonymousId": "00000000-0000-4000-8000-000000000001",
  "sessionId": "00000000-0000-4000-8000-000000000002",
  "url": "https://example.com/pricing/",
  "referrer": "referrer.example",
  "properties": {
    "nav": "navigate",
    "utm_source": "facebook",
    "utm_medium": "paid_social",
    "ad_id": "120211234567890123",
    "adset_id": "120211234567890124",
    "campaign_id": "120211234567890125",
    "utm_placement": "instagram_stories"
  }
}
